评论者网名,评价,评论,评论时间,评论地点,评论点赞数
浆糊骗子,较差,"苏联电影翻拍而来的时装惊吓片。男性凝视下的操控就是用汹涌的海浪声让他癫狂。手机屏幕反复提醒你剧情全程发生在能收到内地手机信号的地方，又已知泰国缅甸马来西亚续签不设门槛，那么他要过期的很可能不是签证而是签注。
与内地其他话剧风/剧本杀影片一样，气场靠端，演技靠吼，音效告知你此处是反转，特写提醒你后面有呼应。唯一的区别是这部的特效不寒酸，弥补了场景的粗劣感。",2023-06-22 10:34:19,北京,364
-Sycho,推荐,麻痹，看一肚子气。展示b超和最后彩蛋是败笔，建议删除，b超建议改成何非死不悔改，这种人天生坏种，如果因为怀孕而悔改只可能是因为他觉得孩子是他要钱的保障。彩蛋更是看一肚子气。但是女生都应该看看这部电影。,2023-06-22 19:26:46,安徽,233
丁鱼,较差,陈思成的油臭味充斥在整个电影院，恶心到想吐。,2023-07-03 00:25:17,新疆,84
知识原子,推荐,我觉得陈思诚可能不懂女性主义，但是他确实一定了解男的，建议查查，不像编的。,2023-07-01 19:30:21,北京,67
我想慢慢走,很差,我先明说 我没有给陈思诚贡献票房 因为几个朋友在讨论 我好奇在网上找个枪看的 事实证明这人不能挨 我以后再看和他沾边的的电影我脑残,2023-07-01 18:06:00,广东,140
五色全味,较差,倪妮掏出b超照片表示你老婆真的好愛你 朱一龍痛苦流涕感受到老婆真的好愛他時 我嚇傻了,2023-07-02 18:38:45,上海,69
CrazyPeter,推荐,稍显用力过猛，整体优质。最后用孩子来唤醒罪恶其实很难，你以为是人性的光辉，其实是另一个悲剧的开始。,2023-06-23 22:13:48,吉林,109
Julio尤里奥,还行,"1.这个故事完全应该在倪妮漏出纹身的时候就结束，因为已经完全交代清楚了，后面完全是画蛇添足。
2.三个主要男女角色的表演都太差了
3.剧情是及格的
4.画面、布景等等太精致了，像在看时尚杂志一样，好像一点尘土都不能进入镜头。",2023-06-29 20:31:50,陕西,63
一罐冰可乐,还行,男人不会后悔杀了自己的老婆，却会后悔杀了自己的孩子。很讽刺。,2023-07-02 01:36:16,浙江,73
yanganron,还行,5分，陈思诚夹带私货也就算了，姑且认为“我最讨厌渣男”这句是讨好女性观众，问题是这让电影的中心思想一下变得很low，男主这是一个“渣男”可以概括的吗，那是人渣啊，就像是人家在抢银行你却说人家是小偷，我只能说格局太小了，也就意味着故事也很难得到升华……他确实借鉴了很多国外电影，但是飙几句英语并不能表示他学到了精髓。总之就算是他对国外经典的一些拙劣模仿吧……（话说就没有人疑惑尸体在海里半个月还这么完整吗）,2023-07-01 02:18:58,北京,83
新新新裤子,较差,电影散发着浓浓的陈思诚风格，投机，浮夸，急于求成，有点小聪明，总想显得有大才华，最后让人讨厌,2023-07-01 09:50:25,湖北,110
BATIGOL927,还行,整个片就跟zyl的演技一样，你不能说他烂，但就是get不到，可能这就是畸形智杜下催生的畸形电影吧。,2023-06-24 14:19:37,湖北,158
momo,较差,营销大片，你可以永远不相信国产电影，中间有几段我感觉在看小时代5）文咏珊很美，但是演技真的烂烂烂，整个片子都充斥着男导演的自以为是👎,2023-06-25 00:06:31,云南,247
小黑,推荐,拆散一对拉拉，毁了两个家庭，建议国家放开同性婚姻限制,2023-07-04 02:23:00,广东,66
,,,,,
TaZ_XCX,还行,留学国外学艺术的富家女到底为什么因为一个男的喜欢梵高的星空而被打动啊/片尾的b超照片被彻底无语了/和妈妈一起去看的，电梯里家长都在教育女儿不要恋爱脑🤣,2023-06-28 16:53:07,江苏,77
来年夏天,还行,冰块里面的M还给了特写，在这网络时代居然找不到李木子一张合照,2023-06-27 07:33:23,河南,78
波摩15,还行,陈思诚的片总觉得像是特商务，包装特别好，但是吃完总觉得味道上差点啥，而且还没吃饱的一顿饭,2023-06-24 00:33:23,北京,100
look_back,很差,"陈思诚滚回去拍你的麦麸黄片。
奉劝朱一龙粉丝少吹这部打着爱女旗号的男凝垃圾。",2023-07-03 23:39:41,宁夏,111
朋也,还行,反转意料中 能拍点les挺好的 恋爱脑配赌徒很中式 就是结尾彩蛋和怀孕属实被恶心到了,2023-06-22 22:47:23,北京,154
元气犀牛,还行,"说实话挺一般，陈思诚非常知道流量密码是什么，姬圈大佬的女女CP，渣男话题。但就是太知道，就失了舒适度。作品越来越刻意，全程一惊一乍的，极为刻意的手法，生怕别人不知道他牛逼的感觉，疯狂炫技。一点也没有被吓到，也没有因此感受到半点片尾想表达的那些文字信息。只感受到导演溢出屏幕的：“我牛逼吗？快夸夸我”的中年油腻。
三星完全是给几个好演员的好演技，尤其是朱一龙的表演很惊喜。",2023-06-29 23:06:00,湖南,68
呱,很差,为什么中国男性导演总喜欢无脑化女性,2023-06-25 00:08:44,重庆,352
almost511,很差,都不知道从哪里开始骂😄,2023-06-26 12:08:17,湖北,277
已注销,推荐,男主最后看到b超照片崩溃，不是因为看到了孩子的存在而后悔崩溃。“赌棍只是哭自己沉不住气，把牌桌踹翻了才发现，其实早抓了一手赢面这么大的牌。”最烦那种说，早猜到了好无聊啊啥啥啥的，值得讨论的是人性的恶，而不是你那份愚蠢的傲慢。,2023-06-27 01:07:34,上海,97
BiBi,还行,彩蛋很懂恶心人,2023-06-25 00:27:10,福建,99
伯伯lee,还行,陈思成是懂渣男的（然而我们究竟需不需要男性视角下的女性主义）,2023-06-25 17:26:59,上海,95
༺❦熱憂༄ོ࿆,推荐,看完电影真的能学到很多：结婚不要找赌徒，不要去东南亚，不要玩潜水，不要丁克，不要找闺蜜看不上的男人，不要赌博，不要惹导演系的，不要在警察局外面报案，不要瞎总结,2023-07-02 08:59:10,重庆,47
徐若风,推荐,婚姻即是一场悬案。也许你以为找到最合适的人，却发现爱上的对象并不是自己设想的样子，此时又该做出什么选择？出色的类型片处女作，看完仍会感到心有余悸。寻找失踪妻子的疑案，演变为真假妻子之谜，又转变成罗生门式的丈夫真假谎言。全员各执一词，不断颠覆此前建立的人物关系。朱一龙的人物形象前后翻转多次，他给出了自如的表演节奏，又以许多微表情埋下伏笔。,2023-06-21 20:24:13,北京,363
鸠魁,较差,陈思诚不会觉得自己能拍出来很牛吧🥺,2023-06-26 15:16:05,江苏,178
hikari,推荐,全片让我最惊讶的点：海底星空居然是真的。,2023-07-02 09:23:48,福建,64
莱子、小时候,还行,"她为什么不把铁丝解开啊
那难道是个死扣吗？",2023-06-26 23:48:28,北京,76
冰山的阴影,较差,麻烦内地的编剧们不要再糟蹋梵高了好吗。,2023-07-01 20:07:48,福建,106
小夜子,力荐,太牛了啊。颠覆性表演啊 。,2023-04-23 20:58:25,北京,1570
仿真男孩哪吒,较差,好久没看到过这么假模假式并离谱的电影了,2023-06-23 20:05:35,宁夏,258
思小泡,还行,渣男的一滴泪是为了肚子里的孩子？我不相信。以及彩蛋真的莫名其妙极了🤷,2023-07-02 23:35:47,北京,50
,,,,,
,,,,,
